NCT05415631,"Bladder Cancer, Cystoscopy, Artificial Intelligence",Augmented Bladder Tumor Detection Using Real Time Based Artificial Intelligence,,,Unaddressed,500,,,Observational,,"Inclusion Criteria:

unifocal primary or recurrent suspected bladder cancer with tumor size less or equal than 3 cm
multifocal primary or recurrent suspected bladder cancer less or equal than 5 lesions and with tumor size less or equal than 3 cm.

Exclusion Criteria:

Evidence of more than 5 tumors or more than 3 cm
computed tomography/cystoscopy suspect of muscle-invasive bladder cancer (cT2 or higher)
computed tomography/magnetic resonance evidence of distant metastases (lymphatic or organic)
Exclusion criteria will include gross hematuria and bacillus Calmette-Guerin (BCG) treatment or chemotherapy within 3 months of inclusion
An exception will be made if patients had received only a single course of chemotherapy immediately following TUR
Patients objecting to the use of their data in the context of research.",France,2022-06-13
NCT04216901,"Colonic Diseases, Artificial Intelligence",A Single Center Study on the Effectiveness and Safety of Polyp Classification With Artificial Intelligence,2021-06-30,Endoscopists refer to AI for diagnosis,Unaddressed,70,"Calculate the accuracy of ai's judgment on whether ESD should be implemented.Accuracy is: the machine over a period of time to judge the results are consistent with the pathological lesion number of molecules, all lesions detected by a period of time for the denominator expressed as a percentage.The gold standard is the pathological results of diagnostic treatment. After the specimen was removed, the area suspected by endoscopists of early cancer was marked with Indian ink for pathological recovery.The specimens were then placed in formalin and fixed for 24 hours until the ink was a little dry.Even if the specimen is cut into 2mm-wide shapes, the suspected area can be identified by Indian ink staining under a microscope.The doctor suspected cancer patients were followed up for 60 days., Calculate the accuracy of the machine in locating the field of vision.The accuracy was as follows: the visual field localization results of the machine on the ESD intraoperative lesion screen captures were the numerator consistent with the number of visual fields determined by multiple endoscopists, and the number of visual fields of all localization in the same operation was the denominator, and the result was expressed as a percentage.The consistent results of visual field positioning by multiple endoscopic physicians watching the operation video were the gold standard.Patients with suspected cancer were followed up for 60 days, and the most serious pathological diagnosis within 60 days was taken as the diagnosis of the patient's disease.Patients whose doctors deemed no risk were followed until the end of colonoscopy.","Consistent of classification among different endoscopists, Consistent of classification between diagnostic system and endoscopists, Consistent of vision positioning between diagnostic system and endoscopists",Observational,,"Inclusion Criteria:

male or female aged 18 or above;
colonoscopy and related examinations should be performed to further clarify the characteristics of digestive tract diseases;
be able to read, understand and sign the informed consent;
the researcher believes that the subject can understand the process of the clinical study, is willing and able to complete all the study procedures and follow-up visits, and cooperate with the study procedures;
patients with > 1cm lesion detected by colonoscopy, requiring magnification staining or surgical resection.

Exclusion Criteria:

have participated in other clinical trials, signed the informed consent and have been in the follow-up period of other clinical trials;
drug or alcohol abuse or psychological disorder in the last 5 years;
pregnant or nursing women;
subjects with previous history of intestinal surgery;
the researcher considers that the subject is not suitable for colonoscopy and related examination;
high-risk diseases or other special conditions that the investigator considers inappropriate for the subject to participate in the clinical trial.",China,2020-01-03
NCT04679181,Homes for the Aged,"Acceptability Assessment of an ""Organization of Care Integrating Artificial Intelligence and a Solution of Telemedicine"" on Care of the Nursing Home Residents Located in a Medical Desert: Pilot Study INTEL@MED-POC",2023-03-25,Telemedecine,Not Applicable,308,"Proportion of the Artificial Intelligence / Telemedecine utilization by the nurse vs medical doctor as usual care, Comparison of non programmed hospitalization in both distant medical doctor analysis and medical doctor as usual care, Comparison of time to obtain the medical expertise for distant medical doctor and usual care recommandations",Calculation of sensitivity and specificity of diagnostic for acute disease and emergency for both distant medical doctor and usual care recommendations,Interventional,,"Inclusion Criteria:

Patient older than 65 years old.
Patient living in Nursing Home located in medical desert.
Patient presenting symptoms involved medical doctor call.
Patient or legal representative having signed consent form
Patient covered by social security

Exclusion Criteria:

End of life patient.
Chronic aphasic patient.","France, France, France, France, France, France",2020-12-22
NCT06036394,CNS Tumor,Artificial Intelligence in CNS Radiation Oncology,,"The images (CT, MRI, PET) used for RT planning, mid-treatment imaging as part of IGRT or disease evaluation, and response assessment/ surveillance post-RT",Unaddressed,6000,The agreement between manual segmentation and automated segmentation using an artificial intelligence-based model will be assessed using Dice coefficient of similarity.,"Quantitative image analysis from target volumes and organs at risk and correlation with survival and normal tissue complications. Survival analysis will be done using Kaplan Meier method and nomograms will be constructed from quantitative imaging features. Toxicity assessment will include the incidence of radionecrosis and the correlation of quantitative imaging markers will be done using regression models or machine learning algorithms., Quantitative analysis of radiation dosimetric maps and correlation with survival and toxicity. The performance metrics of the radiomics model in the prediction of recurrence/ death or toxicity (necrosis) will be compared with ground truth using sensitivity, specificity, accuracy, area under curve., Development of an automated response assessment algorithm using the images (MRI/ CT/ PET scan) following radiation. The predicted response using machine learning algorithms will be compared with actual outcomes (response/ stable disease/ progressive disease) and performance measured in the form of sensitivity, specificity, accuracy, area under curve.",Observational,,"Inclusion Criteria:

• Patients with CNS tumors treated with radiation in TMC between January 2010 and December 2022.

Exclusion Criteria:

RT treatment outside TMC.
Radiation planning not done in the treatment planning system (treated using clinical marking/ conventional simulator).",,2023-09-13
NCT05452993,"Diabetic Retinopathy, Artificial Intelligence, Diabetes Mellitus",Screening for Diabetic Retinopathy in Pharmacies With Artificial Intelligence Enhanced Retinophotography,,Analysed Retinophotography,Not Applicable,330,"The screening rate for diabetic retinopathy will be assessed in the 11 participating pharmacies and then compared to literature data (actual diabetic retinopathy screening rate = 64%)

The screening rate will be calculated as follows :

Number of patients screened(Arm 1)/(number of patients screened (Arm 1) + number of patients who refused screening or failed screening (Arm2)).

We hypothesise an improvement of 10 points (≥74%)","Measurement of patients and pharmacists' satisfaction will be assessed with specific questionnaires, Cost of screening per patients will be calculated, by dividing total cost of this study by the number of patient screened for diabetic retinopathy., The rate of interpretable retinophotographies will be evaluated., To assess the possibility to identify diabetic retinopathy lesions at earlier stages than the conventional screening strategy, To evaluate consistance between artificial intelligence and ophthalmologist re-read for doubtful images",Interventional,,"Inclusion Criteria:

Adult patients with diabetes
Ongoing diabetes treatment (oral hypoglycaemic agents, injectable GLP-1 receptor agonists and insulin)
Regular customer of the pharmacy (at least 3 previous visits)
Informed consent to participate to the study

Exclusion Criteria:

Patient unable to read, write or give consent
Patient refusing to share results with their general practitioner or ophthalmologist",,2022-07-12
NCT03682783,Glaucoma Eye,Artificial Intelligence-assisted Glaucoma Screening (AIAGS),2021-10-30,Fundus Image,Unaddressed,8000,"The specificity of the algorithm for diagnosing glaucoma will be calculated ..., The sensitivity of the algorithm for diagnosing glaucoma will be calculated .",,Observational,,"Inclusion Criteria:

able to complete fundus images

Exclusion Criteria:

unable to complete fundus images",China,2018-09-25
NCT04837599,"Colonic Polyp, Adenoma",Artificial Intelligence Performance in Colonoscopy in Daily Practice,2022-10-31,Discovery TM of Pentax medical on/off in colonoscopy,Not Applicable,1100,"measurement of ascent, descent and intervention time during colonoscopy",counts of polypes and their location in the colon and their histology,Interventional,,"Inclusion Criteria:

all patients referred and fit for an ambulant colonoscopy

Exclusion Criteria:

none",Switzerland,2021-04-08
NCT04551287,"Cervical Cancer, Diagnostic Platform, Diagnosing Cervical Cytology Grades and Cancer, Artificial Intelligence",Artificial Intelligence Enables Precision Diagnosis of Cervical Cytology Grades and Cervical Cancer,2020-12-14,,Unaddressed,16164,Area under the curve,"The true negative rate (TNR) of the diagnostic platform, which is the ratio between the number of negative individuals correctly categorized by platform and the total number of actual negative individuals (%)., The true positive rate (TPR) of the diagnostic platform, which is the ratio between the number of positive individuals correctly categorized by platform and the total number of actual positive individuals (%)., The quantity of true positive (TP) plus true negative (TN) over the quantity of (TP) plus true negative (TN) plus false positive (FP) plus false negative (FN).",Observational,,"Inclusion Criteria:

Women Aged 25-65 years old.
Availability of confirmed diagnostic results of the cervical liquid-based cytological examination, and satisfactory digital images from the liquid-based cytology pap test: at least 5000 uncovered and observable squamous epithelial cells, samples with abnormal cells (atypical squamous cells or atypical glandular cells and above).

Exclusion Criteria:

Unsatisfactory samples of cervical liquid-based cytological examination: less than 5000 uncovered, observable squamous epithelial cells, and more than 75% of squamous epithelial cells affected because of blood, inflammatory cells, epithelial cells over-overlapping, poor fixation, excessive drying, or contamination of unknown components.
Women diagnosed with other malignant tumors other than cervical cancer.","China, China, China",2020-09-16
NCT04046497,First Episode Psychosis,Artificial Intelligence to Measure Adherence to Oral Medication,2024-12-31,"Smartphone App, Usual Care",Phase 4,200,Provides participant utilization of psychiatric ER visits or psychiatric hospitalization,,Interventional,,"Inclusion Criteria:

Enrolled in a CSC program
Prescribed an oral antipsychotic

Exclusion Criteria:

none","United States, United States, United States, United States, United States",2019-08-06
NCT05323279,"Colonoscopy, Artificial Intelligence, Gastrointestinal Disease, Deep Learning",Evaluate the Effects of An AI System on Colonoscopy Quality of Novice Endoscopists,2022-11-24,artificial intelligence assistance system,Not Applicable,685,The number of newly detected adenoma in the second examination divided by the total number of adenoma detected in both examinations,"The numerator is the number of patients diagnosed with advanced adenomas, and the denominator is the total number of patients undergoing colonoscopy. Advanced adenoma was defined as > 10mm, villous adenoma, tubular villous adenoma, high-grade intraepithelial neoplasia, and carcinoma., The numerator is the number of patients with polyps detected by colonoscopy, and the denominator is the total number of patients who underwent colonoscopy, The numerator is the total number of adenomas detected by colonoscopy, and the denominator is the total number of patients undergoing colonoscopy., The numerator is the number of patients with large (≥10 mm), small (6-9 mm) and micro-small (≤5 mm) polyps detected by colonoscopy, and the denominator is the total number of patients receiving colonoscopy., The numerator is the total number of large (≥10 mm), small (6-9 mm) and micro-small (≤5 mm) polyps detected by colonoscopy, and denominator is the total number of patients undergoing colonoscopy., The numerator is the number of patients with large (≥10 mm), small (6-9 mm) and micro-small (≤5 mm) adenomas detected by colonoscopy, and the denominator is the total number of patients receiving colonoscopy., The numerator is the total number of large (≥10 mm), small (6-9 mm) and micro-small (≤5 mm) adenomas detected by colonoscopy, and the denominator is the total number of patients undergoing colonoscopy., The numerator is the number of patients with adenomas detected in the rectum, sigmoid colon, descending colon, transverse colon, ascending colon, ileocecal region and other sites during colonoscopy, and the denominator is the total number of patients receiving colonoscopy., The numerator is the total number of adenomas detected in the rectum, sigmoid colon, descending colon, transverse colon, ascending colon, ileocecal region and other sites during colonoscopy, and the denominator is the total number of patients undergoing colonoscopy., The numerator is the number of patients diagnosed with adenomas, and the denominator is the total number of patients undergoing colonoscopy.",Interventional,,"Inclusion Criteria:

Male or female ≥18 years old;
Able to read, understand and sign an informed consent;
The investigator believes that the subjects can understand the process of the clinical study, are willing and able to complete all study procedures and follow-up visits, and cooperate with the study procedures;
Patients requiring colonoscopy.

Exclusion Criteria:

Have drug or alcohol abuse or mental disorder in the last 5 years;
Pregnant or lactating women;
Patients with known multiple polyp syndrome;
patients with known inflammatory bowel disease;
known intestinal stenosis or space-occupying tumor;
known colon obstruction or perforation;
patients with a history of colorectal surgery;
Patients with a previous history of allergy to pre-used spasmolysis;
Unable to perform biopsy and polyp removal due to coagulation disorders or oral anticoagulants;
High-risk diseases or other special conditions that the investigator considers the subject unsuitable for participation in the clinical trial.",China,2022-04-12
NCT05371314,ARDS,Artificial Intelligence in Categorizing the Severity of Oxygenation by Incorporating the PEEP Into the Definition of ARDS in Ventilated Patients,2023-01-30,P/FP ratio,Unaddressed,5000,"To see the trend and difference between day 1, 2,3 and day 7 between P/F (PaO2/FiO2) and S/F(SaO2/FiO2) ratio to P/FP (PaO2/FiO2*PEEP) ratio and S/FP (SpO2/(FiO2*PEEP) ratio respectively.",,Observational,,"Inclusion Criteria:

1. Intubated patients

Exclusion Criteria:

pediatric and neonates
DNR patients
Non intubated patients",Singapore,2022-05-12
NCT05858762,Breast Cancer Diagnosis,Artificial Intelligence for Automated Diagnosis of Breast Cancer,2023-12-31,Breast digital tomosynthesis,Unaddressed,200,"Lesion detction is based on breast density, case type, BIRADS assessment categories, mammographic appearance, size and pathological profile of malignant lesions",,Observational,,"Inclusion Criteria:

Patients who refer to the Regina Elena for diagnostic mammography tests
Informed consent

Exclusion Criteria:

presence of prostheses, artifacts, outcomes of a study in the breast intervention under the study","Italy, Italy",2023-05-15
NCT05032651,End Stage Renal Disease on Dialysis,Use of a Novel Artificial Intelligence Assisted Platform to Assess Optimal Dosing and Treatment Strategy of Erythropoiesis-stimulating Agents (ESA) in Hemodialysis Patients,2023-12-23,novel artificial intelligence assisted platform,Not Applicable,130,Maintain hemoglobin at the treatment target of 10 g/dl to 12 g/dl.,"The Proportion of Participants with haemoglobin within the target range (10-12gm/dl), The Proportion of Participants Who Received a Whole Blood or Red Blood Cell Transfusion",Interventional,,"Inclusion Criteria:

signed informed consent
Age older than 20 year old.
End stage renal disease under regular hemodialysis with three times per week and duration of each session at least 4 hours
Having at least consecutive 6 months data of both Hb and biochemical study during dialysis before enrollment and at least one Hb level within the range of 11-12 g/dl
Having at least one prescription of ESA supplement to keep Hb within the range of 10-12 g/dl in the past 6 months before the enrollment
Having received ESA of the same brand at least 6 months before the enrollment

Exclusion Criteria:

Ever receiving blood transfusion in the past 12 months
Active bleeding with blood loss more than 250cc in 3 months before the enrollment
Active infection or malignancy
Study subject can not follow with the study protocol

End of Study

The eligible subject will not be allowed to continue the study once informed consent is withdrawn or event happening meets the following criteria:",Taiwan,2021-09-02
NCT03621462,"Melanoma (Skin), Basal Cell Carcinoma of the Skin, Squamous Cell Carcinoma of the Skin",Elucid Labs AIDA™ - Labelled Image Acquisition Protocol,2020-10-15,Artificial Intelligence Dermatology Assistant (AIDA™),Not Applicable,4000,"The investigator will review the standard dermoscopy image for the lesion, score it according to the ABCD rule, and state their diagnosis (malignant, dysplastic, or benign) and their diagnostic confidence using a visual analog scale. Subsequently, the investigator will review the AIDA™ outputs and again state their diagnosis and confidence. The sensitivity of those in-clinic diagnoses will be determined by using the definitive diagnoses established in the histopathology reports.

The sensitivity of a diagnostic technique determines the probability of a positive test result in a person who has the disease. This is defined according to the equation: TP/(TP + FN) . In this equation, TP is the number of true-positive and FN is the number of false-negative results., The investigator will review the standard dermoscopy image for the lesion, score it according to the ABCD rule, and state their diagnosis (malignant, dysplastic, or benign) and their diagnostic confidence using a visual analog scale. Subsequently, the investigator will review the AIDA™ outputs and again state their diagnosis and confidence. The specificity of those in-clinic diagnoses will be determined by using the definitive diagnoses established in the histopathology reports.

The specificity of a diagnostic technique refers to the probability of a negative test result in a person who does not have the disease according to the equation: TN/(TN + FP). In this equation, TN is the number of true-negative and FP is the number of false-positive results.",,Interventional,,"Inclusion Criteria:

Is 18 years of age or older
Has provided informed consent to participate in the study

Is being evaluated by a dermatologist for at least one pigmented skin lesionscheduled for biopsy and meeting the following:

Has a diameter of at least 1 mm and at most 10 mm
Is accessible to the study device (allows for complete seal of device with skin-ie. no ambient light leakage)
Is not within 1 cm of the eyes, on mucosal surfaces, palmar hands, plantarfeet, or under nails
Is intact (eg. no open sores, ulcers, bleeding)
Has not previously been biopsied, excised or traumatized
Does not contain visible scarring or foreign material (eg. tattoos, etc.)

Exclusion Criteria:

1. Any allergy to isopropyl alcohol",Canada,2018-08-08
NCT04661488,"Artificial Intelligence, Triage",Safety and Reliability of Artificial Intelligence Driven Symptom Assessment in Children and Adolescentes,2021-12-01,AI driven triage-system,Unaddressed,1000,AI-driven automated analysis of triage urgency (ESI index) will be compared with the index estimated by healthcare professionals,AI-driven automated analysis of diagnosis will be compared with the diagnosis estimated by healthcare professionals,Observational,,"Inclusion Criteria:

all patients at the emergency department with acute symptoms

Exclusion Criteria:

Emergency situation",,2020-12-10
NCT05041283,Bowel Preparation,Impact of Artificial Intelligence-based Patient Reinforcement on Quality of Colonoscopy,2022-02-01,"Chatbot, Phone call",Not Applicable,258,"evaluated with the Boston Bowel Preparation Scale (0-9, 1=worst preparation, 9= best preparation)","Via questionnaire; 8 items, ordinal scale with 4 grades (completely satisfied/mainly satisfied/mainly dissatisfied/completely dissatisfied), Rate of successfully completed colonoscopy without premature termination due to remaining feces(from anus to terminal ileum), Total amount of administered sedation per examination, Successful coecal intubation during colonoscopy, Rate of detected polyps and adenomas, Via questionnaire; 8 items, ordinal scale with 4 grades (completely satisfied/mainly satisfied/mainly dissatisfied/completely dissatisfied), German ABI-MS questionnaire (questionnaire on overcoming fear considering medical therapy;",Interventional,,"Inclusion Criteria:

informed consent
smartphone with access to WhatsApp
indication for ambulatory colonoscopy
ASA I or II

Exclusion Criteria:

no informed consent given or possible
no access to a smartphone with WhatsApp
<18 years old
Pregnancy/Lactation
Allergy to Moviprep©
ASA (American Society of Anesthesiologists) state >II
extended abdominal surgery in past history
no indication for ambulatory colonoscopy","Germany, Germany, Germany",2021-09-13
NCT06037057,"Deep Learning,Lumbar Magnetic Resonance Imaging",Application of Artificial Intelligence Deep Learning Technology in Magnetic Resonance Lumbar Imaging,2024-03-08,no intervention name,Unaddressed,40,manuscript,,Observational,,"Inclusion Criteria:

Patients of both sexes, aged ≥18 years, with no history of lumbar surgery, underwent lumbar magnetic resonance imaging examination.

Exclusion Criteria:

With metal implants in the body, claustrophobic, unable to lie flat for 15 minutes, with a history of lumbar surgery.",,2023-09-14
NCT06013852,"Fractures, Bone",Impact of Artificial Intelligence Detecting Fractures in the Emergence Department : a Pragmatic Prospective Study,,"processing the radiography with the ""Boneview"" software",Not Applicable,1600,Compare ER support decisions without and with fracture diagnostic software,,Interventional,,"Inclusion Criteria:

Major patient
Admitted to the emergency department after trauma less than 48 hours
Patient with an indication on an x-ray of the limbs or/and pelvis
Express patient consent
Affiliated patient or social security beneficiary

Exclusion Criteria:

Polytraumatized patient
X-ray of the corso-lumbar spine, skull, cervical spine (all parts of the body not affected by the intended use of the software)
Pregnant, lactating or parturient patient",,2023-08-28
NCT05463523,"Skin Diseases, Artificial Intelligence, Augmented Reality, Medical Imaging",A Multi-centric Clinical Trial in China for Skin Diseases Intelligent Diagnosis and Treatment System,2025-12-31,A Real-time Augmented Reality Device with Artificial Intelligence Integration,Unaddressed,200,"Compare the proposed system's perfomance with the doctors in the terms of the diganosis and lesion segmentation. After using the system and the device, doctors evaluated its performance on the Skin Lesion Boundary Description, Margin Design, Sampling Navigation, Projection Effect, Security, Time-consuming and Convenience. 0-10 points for each indicator is scored independently by 4 doctors.",,Observational,,"Inclusion Criteria:

Informed consented.
With a diagnosis of skin disease made by at least 3 dermatologists.
Without life-threatening risk to intervention.
Requires surgical treatment (For devices).

Exclusion Criteria:

Having difficulties to follow-up.
Poor general condition.",China,2022-07-19
