NCTId,Condition,Brief Title,Completion Date,Intervention Name,Phase,Enrollment,Primary Outcome,Secondary Outcome,Study Type,Lead Sponsor,Eligibility,Location,Study First Post Date
NCT04678375,"Artificial Intelligence, Retinal Diseases",Artificial Intelligence for Detecting Retinal Diseases,2020-10-01,Retinal diseases diagnosed by artificial intelligence algorithm,Unaddressed,1000000,"We used the receiver operating characteristic (ROC) curve and area under curve to examine the ability of this artificial intelligence algorism recognition and classification of retinal diseases., We used sensitivity and specificity to examine the ability of this artificial intelligence algorism recognition and classification of retinal diseases., We used positive predictive value and negative predictive value to examine the ability of this artificial intelligence algorism recognition and classification of retinal diseases., We used F1 score to examine the ability of this artificial intelligence algorism recognition and classification of retinal diseases.","Using medical records as the gold standard, we test the accuracy of this artificial intelligence algorism recognition and classification of systemic biomarkers and diseases: age, sex, blood pressure, blood hemoglobin, cardiovascular diseases, thyroid function and kidney function.",Observational,,"Inclusion Criteria:

fundus photography around 45° field which covers optic disc and macula
complete identification information

Exclusion Criteria:

insufficient information for diagnosis.",China,2020-12-21
NCT05963802,"Educational Activities, AI (Artificial Intelligence)",Evaluation of the Efficacy and Usability of Artificial Intelligence (ChatGPT) for Health Sciences Students,,Artificial Intelligence (ChatGPT) Group,Not Applicable,50,Technology usability,Student's perception about the use of artificial intelligence,Interventional,,"Inclusion Criteria:

Health Science students
Must be registered for the course Chronic Health Conditions and Disability (HLTH 3503), Fall 2023.

Exclusion Criteria:

• Unable to provide informed consent",Canada,2023-07-27
NCT05820347,Respiratory Failure,Muscle Pressure Estimation With Artificial Intelligence During Mechanical Ventilation,2023-07-18,Artificial Intelligence Estimation of Muscle Pressure during Mechanical Ventilation,Not Applicable,50,"Analysis of the bias and limits of agreement (Bland-Altman plot) between muscle pressure estimated amplitude in cmH2O from artificial intelligence and measured by esophageal balloon., Correlation, reported as R-squared and a correlation plot, between amplitude in cmH2O of muscle pressure estimation by artificial intelligence and esophageal balloon., Time difference (in ms) between initiation of a spontaneous breathing cycle and ending of a spontaneous breathing cycle between artificial intelligence and esophageal balloon.","Number of patient-ventilator asynchronies detected using artificial intelligence compared with number of asynchronies detected by experts assessing airway pressure, flow and esophageal balloon waveforms.",Interventional,,"Inclusion Criteria:

Patients under assisted or assist-control mechanical ventilation

Exclusion Criteria:

Contraindication to esophageal catheter insertion (esophageal cancer or bleeding, esophageal fistula, skull base fracture, uncontrolled coagulopathies)
Contraindication to transient neuromuscular blockade
Bronchopleural fistula (persistent air leak)
Hemodynamic instability (norepinephrine > 1mcg/kg/min)
Gestation
Current sinus infection
Refusal from patient's family of attending physician
Palliative care",Brazil,2023-04-19
NCT04676308,Artificial Intelligence,The CERTAIN Study: Combining Endo-cuff in a Randomized Trial for Artificial Intelligence Navigation,2022-05-31,Artificial Intelligence,Unaddressed,1300,To compare the additional diagnostic yield obtained by EndoCuff Vision aided-colonoscopy to the yield obtained by the Standard colonoscopy performed with the Artificial Intelligence ¬-GI GeniusTM- assistance in different colonoscopy settings.,,Observational,,"Inclusion Criteria:

subjects undergoing a colonoscopy for gastrointestinal symptoms, fecal immunohistochemical test positivity, primary screening or post-polypectomy surveillance

Exclusion Criteria:

subjects with personal history of CRC, or IBD.
subjects affected with genetic mutations such as Lynch syndrome or Familiar Adenomatous Polyposis.
patients with inadequate bowel preparation (defined as Boston Bowel Preparation Scale > 2 in any colonic segment).
patients with previous colonic resection.
patients on antithrombotic therapy, precluding polyp resection.
patients with history of colonic strictures, precluding ECV use.
patients who were not able or refused to give informed written consent.",Italy,2020-12-21
NCT03268031,"Artificial Intelligence, Glaucoma",Artificial Intelligence-assissted Glaucoma Evaluation,2020-02-01,Visual field and OCT tests,Unaddressed,10800,Accuracy of diagnosis by artificial intelligence algorithm and compare this result with glaucoma specialists,"Sensitivity of diagnosis by artificial intelligence algorithm, Specificity of diagnosis by artificial intelligence algorithm",Observational,,"Inclusion Criteria:

BCVA>0.1
able to complete reliable visual field test
no history of intraocular surgery or fundus laser

Exclusion Criteria:

1. unable to complete visual field test",China,2017-08-31
NCT05435872,"Diagnoses Disease, Quality Control, Endoscopy, Artificial Intelligence",Gastrointestinal Endoscopy Artificial Intelligence Cloud Platform in Gastrointestinal Endoscopy Screening,2024-07-01,The Artificial intelligence Cloud Platform,Not Applicable,2000,"The number of patients diagnosed with early gastrointestinal cancer is divided by the total number of patients undergoing digestive endoscopy of the intervention group with Artificial Intelligence Cloud Platform Auxiliary and the control group with nothing.

The Early Gastrointestinal cancer in this study is defined as ① early gastric cancer and ② progressive adenoma of the colon and serrated adenoma.

The pathology of biopsies will be referred to the official report of the pathologists in the participating centers, which shall be filled in and uploaded to the cloud platform.","The principle of quality control for gastroscopy in this part is 'no neglected area for observation in the stomach'. The artificial intelligence system can automatically identify the corresponding sites (according to the standard anatomical sites) of the photos taken under the gastroscope and mark them as green on the stomach schematic diagram. After all the sites are observed and corresponding photos are taken, the stomach schematic diagram totally turns green, which would be regarded as no blind sites., The quality control of colonoscopy is assessed with the following criteria: ① Quality of bowel preparations, which is evaluated with the Boston score; ② Withdrawal time, which should be no less than 6 minutes from the time of the first cecum image under colonoscopy to the time of the last rectum image.",Interventional,,"Inclusion Criteria:

From the beginning to the end of the study, patients who received gastroscopy and colonoscopy due to confirmed clinical indications were admitted to Beijing Aerospace General Hospital, Beijing Fangshan District Liangxiang Hospital, People's Hospital of Beijing Daxing District, Gucheng Country Hospital of Hebei Province, and Nanhe Country Hospital of Hebei Province.
After fully informing and answering the questions, the endoscopic examination with Gastrointestinal Endoscopy Artificial Intelligence Cloud Platform can be accepted, and a signed informed consent form can be provided.

Exclusion Criteria:

Patients who refuse to participate in this study;
Patients with intolerance or contraindications to endoscopic examination, such as severe cardiopulmonary diseases, coagulation disorders, or a total of platelet less than 50*10^9/L.",China,2022-06-28
NCT05139186,Artificial Intelligence,The EYE Study Enhancing the Diagnostic Yield of Standard Colonoscopy by Artificial Intelligence Aided Endoscopy,2022-12-31,Artificial Intelligence,Not Applicable,1120,"APC, defined as the total number of histologically confirmed adenomas and carcinomas detected in the colonoscopy divided by the total number of colonoscopies.","PPV, defined as the total number of histologically confirmed adenomas and carcinomas detected during the colonoscopy, divided by the total number of excisions in the colonoscopy.",Interventional,,"Inclusion Criteria:

- patients aged 45 or older undergoing average risk colonoscopy (screening) or follow-up colonoscopy for previous history of polyps (surveillance interval of 3 years or greater).

Exclusion Criteria:

subjects with personal history of CRC, or IBD.
subjects affected with Lynch syndrome or Familiar Adenomatous Polyposis.
patients with inadequate bowel preparation (defined as Boston Bowel Preparation Scale < 2 in any colonic segment).
patients with previous colonic resection.
patients on antithrombotic therapy, precluding polyp resection.
patients who were not able or refused to give informed written consent.",Italy,2021-12-01
NCT05699850,ARTIFICIAL INTELLIGENCE (AI) APPLICATIONS IN REPRODUCTIVE MEDICINE,ARTIFICIAL INTELLIGENCE IN REPRODUCTIVE MEDICINE,2023-04-01,ARTIFICIAL INTELLIGENCE (AI),Unaddressed,10,ARTIFICIAL INTELLIGENCE (AI) APPLICATIONS IN REPRODUCTIVE MEDICINE,,Observational,,"Inclusion Criteria:

fertility related

Exclusion Criteria:

fertile people","Egypt, Egypt",2023-01-26
NCT05566002,"Pulmonary Hypertension, Pulmonary Arterial Hypertension",Artificial Intelligence-assisted Evaluation of Pulmonary HYpertension,2024-12-31,Right heart catheterization,Unaddressed,2000,The investigators will calculate the area under the receiver operating characteristic curve of diagnosis by artificial intelligence-assisted algorithm and compare this index between artificial intelligence-assisted algorithm and RHC.,"The investigators will calculate the sensitivity of diagnosis by artificial intelligence-assisted algorithm and compare this index between artificial intelligence-assisted algorithm and RHC., The investigators will calculate the sensitivity of diagnosis by artificial intelligence-assisted algorithm and compare this index between artificial intelligence-assisted algorithm and RHC.",Observational,,"Inclusion Criteria:

Age ≥18 years old
Patients previously received chest X-ray, electrocardiography, echocardiography, other routine examinations, and RHC at the Fuwai Hospital, CAMS & PUMC, Beijing, China

Exclusion Criteria:

Patients without RHC
The quality of routine examinations and RHC cannot meet the requirement for further analysis
Severe loss of results of routine examinations (chest X-ray, electrocardiography, echocardiography, etc.)",China,2022-10-04
NCT03784209,"Gastric Diseases, Artificial Intelligence, Confocal Laser Endomicroscopy",Automatic Real-time Diagnosis of Gastric Mucosal Disease Using pCLE With Artificial Intelligence,2021-09-29,The diagnosis of Artificial Intelligence and endoscopist,Unaddressed,951,"The primary outcome is to test the diagnostic accuracy, sensitivity, specificity, PPV, NPV of the Artificial Intelligence for diagnosing gastric mucosal disease on real-time pCLE examination.","The secondary outcome is to compare the diagnosis efficiency (including diagnostic accuracy, sensitivity, specificity, PPV, NPV for diagnosing gastric mucosal disease on real-time pCLE examination) between Artificial Intelligence and endoscopists.",Observational,,"Inclusion Criteria:

aged between 18 and 80;
agree to give written informed consent.

Exclusion Criteria:

Patients under conditions unsuitable for performing CLE including coagulopathy , impaired renal or hepatic function, pregnancy or breastfeeding, and known allergy to fluorescein sodium;
Inability to provide informed consent",China,2018-12-21
NCT04131530,"Ulcerative Colitis, Artificial Intelligence, Confocal Laser Endomicroscopy",Automatic Evaluation of Inflammation Activity in Ulcerative Colitis Using pCLE With Artificial Intelligence,,The diagnosis of Artificial Intelligence and endoscopist,Unaddressed,60,"The primary outcome is to test the diagnostic accuracy, sensitivity, specificity, PPV, NPV of the Artificial Intelligence for evaluation of inflammation activity of UC on pCLE examination.","The secondary outcome is to compare the diagnosis efficiency (including diagnostic accuracy, sensitivity, specificity, PPV, NPV ) between Artificial Intelligence and endoscopists.",Observational,,"Inclusion Criteria:

aged between 18 and 80; diagnosed as UC

Exclusion Criteria:

Patients under conditions unsuitable for performing CLE including coagulopathy , impaired renal or hepatic function, pregnancy or breastfeeding, and known allergy to fluorescein sodium; Inability to provide informed consent",China,2019-10-18
NCT05322993,Colonic Polyp,Improving Polyp Detection Rate by Artificial Intelligence in Colonoscopy,2023-12-31,"GI Genius, Standard white light colonoscope",Not Applicable,4500,"Evaluate the PDR with and without the use of GI Genus artificial intelligence, Evaluate if there is an improved PDR after the use of AI","To evaluate if the withdrawal time is influenced by the use of artificial intelligence, To evaluate if there are more registered complications with the use of AI",Interventional,,"Inclusion Criteria:

Patients coming to outpatient clinics to perform colonoscopies

Exclusion Criteria:

Total colectomy
Reservation against registration in Gastronet, the national quality register for colonoscopy in Norway","Norway, Norway, Norway",2022-04-12
NCT04636996,"Coronary Heart Disease, Artificial Intelligence, Sleep Apnea",Effects of AI Assisted Follow-up Strategy on Secondary Prevention in CABG Patients,2022-12-31,artificial intelligence assisted follow-up,Not Applicable,200,The average heart rate during the first 35 days postoperatively,"It includes duration of falling asleep, light sleep, and deep sleep period, The average pulse oxygen saturation during the sleep will be evaluated by the sleep monitor device automatically., The pulse oxygen saturation during the sleep will be recorded by the sleep monitor device and the minimum pulse oxygen saturation will be analyzed., It will be evaluated with the visual analogue scale from 0 to 10. Zero is the lowest level of pain and 10 is the highest level of pain., It will be evaluated with Morisky Medication Adherence Scale (MMAS-4). The patients will receive four questions, which are answered by Yes or No ((Yes=0 and No=1) through the scoring system. Zero is the lowest level of medication adherence and 4 is the highest level of medication adherence., It is defined as re-admission between discharge to 35 days after surgery., refers to the incidence of death from the day of surgery to the end of the trial, regardless of the cause., It refers to the total medical expenses for CABG surgery and the following follow-up process.",Interventional,,"Inclusion Criteria:

Age between 18-70, male or female
Received isolated CABG procedure due to coronary artery disease
Having a smartphone and are willing to cooperate
Signing written informed consent

Exclusion Criteria:

Patients undergoing CABG + valve replacement surgery
Postoperative hospital stays more than 10 days (Due to limited postoperative follow-up time and unstable condition such as incision infection, angina, etc.)
Patients with lung, liver, and kidney failure (Due to organ dysfunction which needs more professional health care and not suitable for this trial)
Patients with Urinary system diseases (Getting up during sleep, which will interfere with sleep monitoring)
Patients mentally or legally disabled
Breastfeeding or pregnant women
End-stage disease, estimated survival time is less than 3 months
Participate in other perioperative intervention studies at the same time",China,2020-11-19
NCT05981950,"Artificial Intelligence, Retinal Diseases",Real-world of AI in Diagnosing Retinal Diseases,2029-08-01,artificial intelligence algorithm,Unaddressed,100000,"We used the receiver operating characteristic (ROC) curve and area under curve to examine the ability of this artificial intelligence algorism recognition and classification of retinal diseases., We used sensitivity and specificity to examine the ability of this artificial intelligence algorism recognition and classification of retinal diseases., We used positive predictive value and negative predictive value to examine the ability of this artificial intelligence algorism recognition and classification of retinal diseases., We used F1 score to examine the ability of this artificial intelligence algorism recognition and classification of retinal diseases.",,Observational,,"Inclusion Criteria:

fundus photography around 45° field which covers optic disc and macula
complete identification information

Exclusion Criteria:

insufficient information for diagnosis",China,2023-08-08
NCT04337229,"Newborn, Comfort, Nursing, Artificial Intelligence",Evaluation of Comfort Behavior Levels of Newborns With Artificial Intelligence Techniques,,Artifical intelligent,Not Applicable,1000,"Images will be taken to transfer behaviors of newborns to the computer. Attention will be paid to making face and body movements visible while taking the image.The camera will take 12 hours of view of each newborn.However, this period can be shortened as a result of preliminary work.",The images of the newborn will be transferred to the computer. The images will be processed by a specialist on computer using artificial intelligence techniques.,Interventional,,"Inclusion Criteria:

Parents' acceptance of their baby's participation in the study
Having a baby born at 24-42 weeks

Exclusion Criteria:

Having a baby born before 24 weeks of gestation or after 42 weeks of gestation.
Has received analgesic, muscle relaxant or sedative drug treatment that may affect comfort and behavior (last 24 hours)
Newborn has serious neurological damage",,2020-04-07
NCT05513638,the Application of Artificial Intelligence in the Diagnosis of Prostate Cancer,Artificial Intelligence-Based Computer-Aided Diagnosis of Prostate Cancer,2026-08-22,the clinical use of artificial intelligence in the diagnosis of prostate cancer,Unaddressed,2000,"Biopsy or surgery confirmed newly-diagnosed prostate cancer and clinically significant prostate cancer will serve as our primary outcome. Details of follow up and disease progression for a period of two years following mp-MRI will also be collected. For patients with no suspicious lesions on mp-MRI or biopsy-negative, follow-up prostatic specific antigen for a period of two years will also be collected.","surgery confirmed T and N staging of prostate cancer, positive rate of prostate biopsy in each arm, The total reviewing time of radiologists will be measured in this aim. The reviewing time will be defined as the time from initiation of interpretating prostate mp-MRI to the time the radiologists finish reviewing and assigning a PI-RADS score.",Observational,,"Inclusion Criteria:

Clinical suspicious of prostate cancer, presenting with an elevated prostatic specific antigen and/or abnormal digital rectal examination

Exclusion Criteria:

(1) <60 years of age; (2) a previous surgery, radiotherapy or drug therapy for prostate cancer (interventions for benign prostatic hyperplasia or bladder outflow obstruction were deemed acceptable); (3) incomplete mp-MRI examination or artifacts of the images.",China,2022-08-24
NCT04294355,"Colon Adenoma, Colon Polyp",Artificial Intelligence-assisted Colonoscopy on Detection of Missed Proximal Lesions,2022-04-15,"Artificial intelligence-Assisted colonoscopy, Conventional colonoscopy",Not Applicable,216,The proportion of patients with missed adenomas detected in the second examination only,"The proportion of patients with missed adenomas detected in the second examination only, The proportion of patients with at least one adenoma, The proportion of patients with at least one polyp",Interventional,,"Inclusion Criteria:

All adult patients, aged 40 or above, undergoing outpatient colonoscopy in the participating centers will be recruited

Exclusion Criteria:

history of inflammatory bowel disease
history of colorectal cancer
previous bowel resection (apart from appendectomy)
Peutz-Jeghers syndrome, familial adenomatous polyposis or other polyposis syndromes
bleeding tendency or severe comorbid illnesses for which polypectomy is considered unsafe.","China, Singapore, Vietnam",2020-03-04
NCT04138771,"Cataract, Postoperative Complications, Artificial Intelligence",Validation of an Artificial Intelligence System for Postoperative Management of Cataract Patients,2020-03-01,An artificial intelligence system for postoperative management of cataract patients,Not Applicable,300,,,Interventional,,"Inclusion Criteria:

Patients who had surgery of cataract extraction combined with introcular lens implantation.
Patients should be aware of the contents and signed for the informed consent.",China,2019-10-24
NCT05807737,Ultrasound Imaging,A Study to Assess the Accuracy of Artificial Intelligence for Ultrasound-guided Regional Anesthesia,2020-11-15,Ultrasound scanning with artificial intelligence,Unaddressed,40,Residents will scan the 40 volunteers (20 male and 20 female) using the artificial intelligence software until obtaining 100% scan success which means all region-related key anatomical landmarks are identified and color-overlayed correctly. The accuracy of key anatomical landmarks will be evaluated by 2 independent experts in the field of regional anesthesia.,"During the scanning, the volunteer's body mass index, gender, and age information will be collected. The accuracy of artificial intelligence software will be evaluated with the collected demographic information in order to learn the difference in accuracy.",Observational,,"Inclusion Criteria:

Volunteers over the age of 18
Able to accept and sign the Informed Consent Form before participating in the study

Exclusion Criteria:

Volunteers below the age of 18
Unwilling to accept or having psychiatric/neurological diseases to sign an Informed Consent Form before participating in the study
Inability to lie flat
Anatomical deformity in the selected regions",Turkey,2023-04-11
NCT04126265,"Artificial Intelligence, Colonoscopy",Artificial Intelligence-assisted Colonoscopy for Detection of Colon Polyps,2020-08-31,Artificial intelligence assisted colonoscopy,Not Applicable,560,"In each group, the number of patients with small polyps was detected as a percentage of the total number of patients.","Number of polyps found in each group., Average size of all polyps detected in each group., Morphological classification of all polyps detected in each group.",Interventional,,"Inclusion Criteria:

Chinese population aged 18-80 years old; Patients voluntarily signed informed consent form; In accordance with the indications of colonoscopy.

Exclusion Criteria:

(IBD) history of inflammatory bowel disease; History of colorectal surgery; Previous failed colonoscopy; Polyposis syndrome; Highly suspected colorectal cancer (CRC)",China,2019-10-15
NCT04289064,"Retinal Diseases, Artificial Intelligence",Artificial Intelligence System for Assessing Image Quality of Fundus Images and Its Effects on Diagnosis,2020-07-01,Taking a fundus image,Unaddressed,300,"Area under the receiver operating characteristic curves, sensitivity, specificity, positive and negative predictive values, accuracy","Cohen's kappa coefficient, P value and other related statistic results",Observational,,"Inclusion Criteria:

Patients should be aware of the contents and signed for the informed consent.

Exclusion Criteria:

1. Patients who cannot cooperate with a photographer such as some paralytics, the patients with dementia and severe psychopaths.
2. Patients who do not agree to sign informed consent.",China,2020-02-28
NCT04314180,"Anterior Segment Disorders, Artificial Intelligence",Artificial Intelligence System for Assessing Image Quality of Slit-Lamp Images and Its Effects on Diagnosis,2020-07-01,Taking slit-lamp images,Unaddressed,300,"Area under the receiver operating characteristic curves, sensitivity, specificity, positive and negative predictive values,accuracy","Cohen's kappa coefficient, P value and other related statistic results",Observational,,"Inclusion Criteria:

Patients should be aware of the contents and signed for the informed consent.

Exclusion Criteria:

1. Patients who cannot cooperate with a photographer such as some paralytics, the patients with dementia and severe psychopaths.
2. Patients who do not agree to sign informed consent.",China,2020-03-19
NCT04442607,Polyp of Colon,Clinical vAliDation of ARTificial Intelligence in POlyp Detection,2022-11-29,artificial intelligence image processing,Not Applicable,856,,,Interventional,,"Inclusion Criteria:

Age ≥40 years
Referral for screening, surveillance or diagnostic colonoscopy
Able to give informed consent by the patient or by a legal representative

Exclusion criteria for study inclusion

<40 years old
Referral for a therapeutic colonoscopy
Known Lynch syndrome or Familial Adenomatous Polyposis syndrome
Any contraindication for colonoscopy or biopsies of the colon
Uncontrolled coagulopathy
Confirmed diagnosis of inflammatory bowel disease prior to the scheduled colonoscopy
Short bowel or ileostomy
Pregnancy

Exclusion criteria for study analysis

Colonic inflammation of > 30cm during colonoscopy
Incomplete colonoscopy for any reason
Incomplete recording or technical failure of the artificial intelligence system",Belgium,2020-06-22
