NCT05754476,Brain Diseases,Multi-center Study of Artificial Intelligence Model for Gadolinium-based Contrast Agent Reduction in Brain MRI (MAGNET),2024-12-31,Low-dose GBCA levels,Unaddressed,3000,"To quantitatively describe the discrepancies between the vir-T1c and the full-dose images by measuring the peak signal-to-noise ratio (PSNR) and structural similarity index (SSIM). The PSNR measures the voxelwise difference and the PSNR range is between -1 and 1. The SSIM compares nonlocal structural similarity and the minimum value of PSNR is 0. The metrics will be reported in separate(e.g.,SSIM, 0.90; PSNR,42 in vir-T1c, SSIM, 0.94; PSNR,45 in full-dose images)., To qualitatively describe discrepancies between the vir-T1c and full-dose images by evaluating enhancement degree, homogeneity, and pattern.

Firstly, zero indicates no intracranial or non-enhancing lesion. For enhancement degree, 1 indicates mild enhancement, 2 indicates moderate enhancement, and 3 indicates clear enhancement.

For enhancement homogeneity, 1 indicates heterogeneous enhancement, 2 indicates mildly heterogeneous enhancement, and 3 indicates homogeneous enhancement.

For enhancement pattern, 1 indicates mass enhancement（proportion enhancement more than 50%）, 2 indicates nodular enhancement (proportion enhancement less than or equal to 50%）, 3 indicates ring enhancement, 4 indicates linear enhancement, and 5 indicates other enhancement.","To describe whether vir-T1c images combing other sequences affect diagnosis or treatment according to evaluation of neuroradiologist and neurologist from 1 to 5 scores.

Zero indicates enhancement error and can not be used. 1 indicates non-diagnostic. 2 indicates affecting diagnosis or treatment significantly. 3 indicates affecting diagnosis or treatment moderately. 4 indicates no affecting diagnosis or treatment almost. 5 indicates no affecting diagnosis or treatment completely.",Observational,,"Inclusion Criteria:

Patients with suspected or known brain diseases including tumors, vascular disorders, inflammatory diseases, neurodegenerative diseases and trauma, follow-up, routine brain, and others requiring MRI exams with GBCAs.
Informed written consent obtained from the patient, and/or patient's parent(s), and/or legal representative.

Exclusion Criteria:

Patients with contraindications to MR examination.
Patients with incomplete MRI data and obvious image artifacts.",China,2023-03-03
NCT05192655,HNSCC,Artificial Intelligence in Functional Imaging for Individualized Treatment of Head and Neck Squamous Cell Carcinoma Patients,2024-12-01,Observation,Unaddressed,250,"Freedom from local progression within the first two years after treatment. Failure of locoregional control is defined as relapse of tumor confirmed by biopsy or if biopsy is inadequate or not feasible, consisting clear image morphology (MRI / CT / PET) during routine follow-up check-ups","Collection of questionares regarding life quality before treatment and during routine follow-up check-ups after treatment regarding to the European Quality of Life Instrument (EURO-QOL), Freedom of Metastasis within the first two years after treatment during routine follow-up check-ups; Metastasis must be confirmed by biopsy or clear image morphology if a biopsy is not feasible (MRI / CT / PET), Collection of questionares regarding toxicity according to Common Toxicity Criteria (CTC) during routine follow-up check-ups, alternative for Overall survival; event in PFS defined as disease progression or death",Observational,,"Inclusion Criteria:

All patients older than 18 years with diagnosed HNSCC, attending the Department of Radiooncology and Radiotherapy or the Department of Oral and Maxillofacial Surgery at Charité for a treatment with curative intension ( R(C)T or primary surgery / combined).
All patients received as pretherapeutic diagnostic method a 18F-Fluorodesoxyglucose (FDG) positron emission tomography (PET) imaging

Exclusion Criteria:

Patients with HNSCC who cannot be treated in a curative approach
Patients with HNSCC treated in a curative approach but unable to receive FDG PET imaging before start of treatment
Data from patients who have withdrawn their study consent",Germany,2022-01-14
NCT05550012,Deep Learning,A New Deep-learning Based Artificial Intelligence Iterative Reconstruction (AIIR) Algorithm in Low-dose Liver CT,2023-04-30,low-dose CT,Not Applicable,100,"Evaluate the image qualities of AIIR for low-dose portal vein and delayed phase liver CT with those of a KARL method normally used in standard-dose CT, Evaluate the image qualities of AIIR for low-dose portal vein and delayed phase liver CT with those of a KARL method normally used in standard-dose CT, Evaluate the diagnostic qualities of AIIR for low-dose portal vein and delayed phase liver CT with those of a KARL method normally used in standard-dose CT",,Interventional,,"Inclusion Criteria:

those scheduled for contrast-enhanced liver CT

Exclusion Criteria:

images affected by artifacts (motion or implants)",China,2022-09-22
NCT05985057,"Carbapenem Resistant Enterobacteriaceae Infection, Artificial Intelligence, Intensive Care Unit",A Novel Approach to Antimicrobial Resistance: Machine Learning Predictions for Carbapenem-Resistant Klebsiella in ICUs,2023-12-30,Artificial intelligence,Unaddressed,300,The sensitivity and specificity of a diagnostic method based on machine learning will be measured with the AUC-ROC curve (Area Under the Receiver Operating Characteristic curve),,Observational,,"Inclusion Criteria:

Patients monitored in our third-level intensive care unit between June 2017 and June 2023 will be evaluated retrospectively. Patients with pneumonia and bloodstream infection developed with Klebsiella spp. will be included in the study.

Exclusion Criteria:

Patients under the age of 18 have not been included in the study.
Infections outside of the respiratory tract and bloodstream have not been included in the study.
Patients with respiratory tract colonization and without active inflammation have also not been included.",Turkey,2023-08-14
NCT05856565,Metastatic Melanoma,"Generation of an Artificial Intelligence Algorithm Based on the Analysis of Melanoma Peri-scar Dermatoheliosis, as a Predictive Factor of Response to Anti-PD-1",2028-06-30,Photo,Unaddressed,700,"The predictive score for tumor progression at 6 months will be calculated from the photograph of the excision scar of the patient's primary tumor, as well as the clinical characteristics associated with the prognosis: patient age, sex, phototype, anatomical location and Breslow index of the primary tumour, stage of the skin cancer and WHO performance status at the initiation of the treatment, nature of the treatment administered",,Observational,,"Inclusion Criteria:

Adult patients with inoperable stage III or IV melanoma, or inoperable skin carcinoma (cutaneous squamous cell carcinoma or basal cell carcinoma)
Retrospective cohort: patients who received systemic treatment for their inoperable skin cancer for at least 3 months, with at least 6 months of follow-up, without immunosuppression and whose site of the primary tumor is not altered by a concomitant dermatosis
Prospective cohort: Patients naïve to immunotherapy for the management of their melanoma at the introduction of systemic treatment. Adjuvant immunotherapy tolerated if it has been stopped for at least 6 months before starting the curative treatment
Patients who have expressed their agreement to participate in the research and who have signed an image rights authorization

Exclusion Criteria:

Retrospective cohort: Patients who received their systemic skin cancer treatment for less than 90 days
Patients who received adjuvant immunotherapy in the 6 months preceding the curative treatment
Patients whose primary skin cancer site cannot be photographed (example of choroidal melanomas, mucosal melanomas except for melanomas with a vulvar or penile starting point, etc.)
Patients treated with systemic corticosteroids (dose greater than 10 mg/day) at the introduction of the immunotherapy under consideration
Immunocompromised patients (associated blood disease, human immunodeficiency virus infection, transplant patient, etc.)
Patients with iatrogenic peri-scarring vitiligo
Patients who refused to participate in the research
Adults protected by law
Pregnant women",,2023-05-12
NCT04016987,Type 1 Diabetes,Automated Structured Education Based on an App and AI in Chinese Patients With Type 1 Diabetes,,Automated structured education intervention based on an app and artificial intelligence,Not Applicable,138,A1c reflects the average blood glucose level in the past 2-3 months.,"TIR measures the time where the blood glucose remains within the proposed target range., Diabetes Quality of Life scale (DQOL) is a wildly used 46-item tool for assessing the quality of life related to diabetes in three aspects: diabetes satisfaction (15 items), impact (20 items), and worry (11 items). Each item is responded to on a 5-point Likert scale, with score of 1 represents ""always affected"", ""always worried"", or ""never satisfied"" and a score of 5 indicates ""no impact"", ""no worries"", or ""always satisfied"". Higher total score reflects better quality of life. A Chinese version of DQOL has been translated and validated in the diabetic population from Mainland China and will be adopted in this trial., Diabetes Self-Management Scale is used to assess diabetes self-management behaviors. This scale contains six aspects with a total of 14 items: dietary management, physical activity, self-monitoring of blood sugar, medical treatment, foot care and smoking. Except for smoking, the other five aspects with 11 items ask the number of days during the last week (ie. how many days did you test your blood sugar during the last 7 days?...). One of the dietary questions (ie. days of high-fat diet consumption) is reversely scored (the more days the fewer score), and the rest are positively scored in 0-7 points. The overall score uses the above five aspects of 11 questions, with a minimum score of 0 and maximum score of 77. Higher score reflects better the self-management behaviors., Diabetes Self-Care Activities (SDSCA) is used to assess diabetes self-care behavior. This scale contains six behavior related scales: general dietary, specific dietary, glucose monitoring, physical activity, foot care, and smoking. Absolute weekly frequency or consistency of diabetes self-care activities are scored with a 0-7 ranged scale, with higher scores reflecting better performance in self-care behaviors. The internal consistency reliability and construct validity of SDSCA was supported by its psychometric test based on an adult diabetes population. A validated Chinese version of the SDSCA (C-SDSCA) is available for this trial., Patients' diabetes-related psychosocial self-efficacy will be evaluated with the Diabetes Empowerment Scale-Short Form, which was a short form of Diabetes Empowerment Scale developed from the America population with type 1 or type 2 diabetes. A revised Chinese version is available for the Mainland China population. The Chinese version DES-SF includes 8 domains with 1 item for each (i.e., assessing the need for change, developing a plan, overcoming barriers, asking for support, supporting oneself, coping with emotion, motivating oneself, and making diabetes care choices appropriate for one's priorities and circumstances). Each item is responded on a 5-point Likert scale, with 1 indicating strongly disagree and 5 indicating strongly agree. Total score ranges from 8 to 40, with higher scores reflect a better psychosocial self-efficacy., State-Trait Anxiety Inventory (STAI) is used for assessing patients psychological status. The Chinese version STAI consists of two sub-scales to measure both state and trait anxiety states. Each of the two anxiety states will be measured with a 20-item sub-scale, and each item will be scored from 1 to 4. The total score for both state and trait anxiety range from 20 to 80, with high scores indicating more serious anxiety., Beck's Depression Inventory (BDI) is used for assessing patients psychological status. The Chinese version BDI (CBDI) consists of 21 self-rated items. Each item will be scored from 0 to 3, with the total score ranges from 0 to 63, and a higher score indicates more serious depression., the blood sugar level after fasting for eight hours, Systolic blood pressure, Diastolic blood pressure, serum total cholesterol level, serum HDL level, serum LDL level, serum triglycerides level, Height in meters will be measured., Weight in kilograms will be measured., Patients' engagement with the app will be measured in terms of communications with the clinician and the utilization of the smartphone app. Specifically, the number of messages sent to patients, the number of message responses, the number of video calls/phone calls with patients, the number of logs entered by patients, and time spent in the health education module will be collected., Safety-related outcomes including hypoglycemic events, hospitalization, and emergency room visits will be collected at each follow-up time point including the monthly telephone interview.",Interventional,,"Inclusion Criteria:

Individuals diagnosed with Type 1 Diabetes according to the 1999 World Health Organization report
Insulin dependence from disease onset
Aged 18-50 years
With a disease duration over 6 months
With a HbA1c level over 7%
Treated T1DM with multiple daily injections or insulin pump
Individuals who own smartphone and are capable of using wechat or apps

Exclusion Criteria:

Age below 18 years or above 50 years
Being pregnant
With mental disorders
Have any other condition or disease that may hamper from compliance with the protocol or complication of the trial
Already using a smartphone app for managing diabetes
Having chronic complications including diabetic retinopathy, diabetic nephropathy or diabetic foot, diabetic neuropathy",China,2019-07-12
NCT04829279,Emergency Patient Transported by Ambulance,Evaluation of Effectiveness for Connected Network for EMS Comprehensive Technical-support Using Artificial Intelligence (CONNECT-AI) System by Community Intervention,2021-12-31,CONNECT AI system group,Not Applicable,15392,Time taken from the time the paramedic arrives at the scene to the transfer hospital,In the case of transfer to another hospital or death without resolving the emergency situation at the initial ED,Interventional,,"Inclusion Criteria:

patients transferred to the local emergency department(ED) through an ambulance of a fire department in the selected community.

Exclusion Criteria:

If the storage and transmission of information collected by an ambulance fails or the information of the transferred patient cannot be verified in the transferred ED","Korea, Republic of",2021-04-02
NCT03874702,"Stroke, Ischemic Stroke",Automated Diagnosis of Stroke in Computed Tomography With the Use of Artificial Intelligence,2025-06-01,,Unaddressed,350,"The Alberta stroke programme early CT score (ASPECTS) 1 is a 10-point quantitative topographic CT scan score used in patients with middle cerebral artery stroke. It has also been adapted for the posterior circulation.

Scoring system

Segmental assessment of the MCA vascular territory is made and 1 point is deducted from the initial score of 10 for every region involved:

caudate putamen internal capsule insular cortex M1: ""anterior MCA cortex,"" corresponding to frontal operculum M2: ""MCA cortex lateral to insular ribbon"" corresponding to anterior temporal lobe M3: ""posterior MCA cortex"" corresponding to posterior temporal lobe M4: ""anterior MCA territory immediately superior to M1"" M5: ""lateral MCA territory immediately superior to M2"" M6: ""posterior MCA territory immediately superior to M3""",,Observational,,"Inclusion Criteria:

Patients with ischemic stroke.
Patients with <4.5 hours of symptom onset.

Exclusion Criteria:

Patients with hemorrhagic stroke diagnosis.
Patients with other cerebrovascular diseases.",Mexico,2019-03-14
NCT05383053,"Alzheimer Disease, Mild Cognitive Impairment",Evaluating the Efficacy of Artificial Intelligence-based Computer Aided Diagnosis Software That Assists in Determining Whether or Not to Conduct Amyloid PET for the Diagnosis of Alzheimer's Disease by Predicting Amyloid PET Positivity in Mild Cognitive Impairment Patients,2022-09-08,NeuroAI,Unaddressed,227,"Clinical efficacy evaluation of the probability of predicting 'NeuroAI' as positive amyloid PET phase for MR images of positive factors as a result of amyloid PET test, Clinical efficacy evaluation of the probability that 'NeuroAI' does not predict positive amyloid PET phase for MR images of negative factors as a result of amyloid PET test","Clinical efficacy evaluation of the area below the ROC graph using the sensitivity (Y-axis) and false positive prediction (1-specificity, X-axis) of amyloid PET positive prediction presented by NeuroAI compared to the amyloid PET test results, Clinical efficacy evaluation of the probability that the amyloid PET test results and the prediction information on the amyloid PET of 'NeuroAI' match",Observational,,"Inclusion Criteria:

Brain MR images of image providers suitable for all of the following selection criteria may be registered in this clinical trial.

Among those diagnosed with mild cognitive impairment (MCI) in accordance with the International Working Group on Mild Cognitive Impairment criteria, those aged 50 or older on the MRI scan date.

Those who have undergone 3D configurable 3T MRI (brain T1 weighted MRI* and T2 FLAIR MRI**) tests.

* 40-slice 2D T1 MRI scan: Plane shall be photographed with sagittal hippocampus.

** 3-slice 2D T2-FLAIR MRI scan: Plane shall be taken by axial.

FBB (F-18 Florbetaben) amyloid PET test for suspected Alzheimer's mild cognitive impairment is positive or negative.

☞ Images diagnosed with clear cerebral matrix damage (e.g., brain tumor, cerebral infarction, brain damage, normal pressure hydrocephalus, encephalitis) or mild cognitive impairment caused by metabolic diseases cannot participate in this clinical trial.

A person who has the following clinical information recorded.

Date of birth (or full age), gender, APOE genotype, mild cognitive impairment diagnosis date, mild cognitive impairment causative disease (Alzheimers, vascular, Louise, Parkinson's disease, frontal lobe, cerebral tumor, cerebral infarction, normal pressure head disease, encephalitis, unknown, other), MRI scan day, amyloid PET test*, FBB PET-BAPL score** **However, for FBB PET BAPL score, you may participate in this clinical trial even if the information is not recorded.

Exclusion Criteria:

Brain MR images of image providers that fall under any of the following exclusion criteria cannot be registered in this clinical trial.

MR images already used as training sets or validation sets for developing medical devices for clinical trials.

☞Chonnam National University Hospital and Chosun University Hospital use images not included in GARD cohort.

If the interval between the date of diagnosis of mild cognitive impairment and the date of MRI scan/amyloid PET examination exceeds 2 years.

If the tester determines that participation in the clinical trial is inappropriate because it may affect other, ethical or clinical trial results.

Specific reasons shall be stated in the case record.","Korea, Republic of",2022-05-19
NCT05740137,"Colorectal Cancer, Colorectal Adenoma, Colorectal Neoplasms",Adenoma Detection Rate in Artificial Intelligence-assisted Colonoscopy,2025-09-30,AI-assisted colonoscopy,Not Applicable,800,ADR = (number of examinations with adenomas/total number of examinations) × 100.,"PDR = (number of examinations with polyps/total number of examinations) × 100., Number of adenomas found per procedure, Number of polyps found during per procedure, Duration of the colonoscopy, Number of resected non-neoplastic polyps/total number of resected polyps, Adenoma detection rate (ADR) in one of the patient subgroups, Positive patient = patient with detected polyps during the colonoscopy",Interventional,,"Inclusion Criteria:

Referred for screening colonoscopy due to a positive faecal immunochemical test (FIT) or for
Diagnostic colonoscopy due to symptoms/signs or
Post-polypectomy surveillance colonoscopy (only patients who had all detected polyps removed in the previous colonoscopy)

Exclusion Criteria:

Referral for removal of previous detected polyps
Emergency colonoscopy
Control colonoscopy due to inflammatory bowel disease (IBD)","Denmark, Denmark, Denmark, Denmark",2023-02-22
NCT04869618,"Gastric Dysplasia, Gastric Intestinal Metaplasia, Gastric Cancer",Validation of an Artificial Intelligence System Based on Raman Spectroscopy for Diagnosis of Gastric Premalignant Lesions and Early Gastric Cancer,,Raman spectroscopy based device (SPECTRA IMDx),Not Applicable,100,"Diagnostic performance: accuracy, positive predictive value and negative predictive value","sensitivity, specificity and accuracy, sensitivity, specificity and accuracy",Interventional,,"Inclusion Criteria:

Known diagnosis of gastric dysplasia with visible lesion or early gastric cancer amenable to gastric ER (EMR or ESD); diagnosis made based on biopsy from gastroscopy performed within past six months
Age 21 to 90 years (selected age range based on demographic of patients managed at Changi General Hospital)
Ability to provide informed consent

Exclusion Criteria:

Subjects without mental capacity, refusal to provide consent, incarcerated status, pregnant subjects.
Subjects with advanced gastric cancer not amenable to endoscopic resection
Subjects with bleeding disorders, such as haemophilia, in whom ER and biopsies are contraindicated.
Subjects with active bleeding or coagulopathy precluding ER and biopsies.
Subject with severe co-morbid illness, such as end-stage renal failure (ESRF), congestive cardiac failure (CCF) and advanced liver cirrhosis.
Subjects on regular anti-platelet medications except aspirin or anti-coagulants must be able to undergo adequate washout period before gastroscopy. The subject's physician or study co-investigator will exercise their clinical judgement to ensure subject's safety.",Singapore,2021-05-03
NCT04576416,"Melanoma, Skin Cancer",Artificial Intelligence Augmented Training in Skin Cancer Diagnostics for General Practitioners,2022-01-31,AI augmented training and clinical feedback,Not Applicable,115,"The participants time spend with the digital educational platform is measured by the platform., The change in diagnostic accuracy is measured as percentage of correctly diagnosed skin lesions., All registered lesions will be evaluated by a expert dermatologist. Using the expert opinion as golden standard a ratio of the benign and malignant skin lesions forwarded by the General Practitioner is calculated.","Participants will answer a 12-item multiple choice test at baseline, after 1 and 3 months. The multiple-choice-questionnaire is validated and descriped here: https://doi.org/10.1007/s00403-020-02097-8 A correlation between the participants MCQ score and their clinical diagnostic accuracy is calculated. A high score correlates to high diagnostic accuracy (better).",Interventional,,"Inclusion criteria:

Participating doctors are required to have a danish doctors authorization and work at least 4 days a week in a general practitioners office.
The participating doctors may register skin lesions on patients of all ages with skin lesions suspected of skin cancer. A skin lesion is for the purpose of this study defined as a mole or tumor that either patient or GP raises suspicion of skin cancer about.

Exclusion criteria:

Doctors that have participated in a small qualitative pilot study are excluded.",Denmark,2020-10-06
NCT05730192,"Colorectal Cancer, Polyp of Colon, Adenoma Colon",EAGLE Trial CADDIE Artificial Intelligence Endoscopy,2024-12-31,CADDIE,Not Applicable,950,"Superiority of CADDIE Arm vs. control., Non inferiority of CADDIE Arm vs. control.",,Interventional,,"Inclusion Criteria:

Screening or surveillance colonoscopy
Age 40 years or older
Informed consent

Exclusion Criteria:

Emergency colonoscopies
Inflammatory bowel disease (IBD)
Colorectal Cancer (CRC)
Previous Colorectal Cancer (CRC)
Previous colonic resection
Returning for a planned elective therapeutic colonoscopy.
Polyposis syndromes (familial adenomatous polyposis)
Contraindication for biopsy or polypectomy.","Georgia, Germany, Italy, Italy, Italy, Poland, Poland, Poland, Spain, United Kingdom",2023-02-15
