NCT04723758,"Colonic Polyp, Colorectal Polyp, Colorectal Adenoma, Colorectal Adenomatous Polyp, Colorectal SSA, Sessile Serrated Adenoma, Sessile Colonic Polyp",COLO-DETECT: Can an Artificial Intelligence Device Increase Detection of Polyps During Colonoscopy?,2023-04-30,"GI Genius-assisted diagnostic colonoscopy, Diagnostic Colonoscopy",Not Applicable,2032,The number of adenomas identified during each colonoscopy will be summed and divided by the total number of colonoscopies performed. MAP is usually expressed as a number to one decimal place (e.g. 1.2).,"Whether or not at least one adenoma is detected at colonoscopy will be determined for each participant. The number of colonoscopies where one or more adenomas is identified will be divided by the total number of colonoscopies to give the ADR. ADR is usually expressed as a percentage., The number of adenomas identified during each colonoscopy within the 'screening' participant population will be summed and divided by the total number of colonoscopies in that participant population. The MAP for the 'screening' participant population within each study arm will be compared, The number of adenomas identified during each colonoscopy within the 'symptomatic' participant population will be summed and divided by the total number of colonoscopies in that participant population to calculate MAP. The MAP for the 'symptomatic' participant population within each study arm will be compared, Whether or not at least one adenoma is detected at colonoscopy will be determined for each participant within the 'screening' participant population. The number of colonoscopies where one or more adenomas is identified will be divided by the total number of colonoscopies in that participant population to calculate ADR. The ADR for the 'screening' participant population within each study arm will be compared, Whether or not at least one adenoma is detected at colonoscopy will be determined for each participant within the 'symptomatic' participant population. The number of colonoscopies where one or more adenomas is identified will be divided by the total number of colonoscopies in that participant population to calculate ADR. The ADR for the 'symptomatic' participant population within each study arm will be compared, The total number of polyps detected during each colonoscopy will be summed, and divided by the total number of colonoscopies, to calculate MPP. MPP is usually expressed as a number to one decimal place., The total number of polyps detected during colonoscopy for each participant within the 'screening' participant population. will be summed, and divided by the total number of colonoscopies in that participant population, to calculate MPP. MPP is usually expressed as a number to one decimal place., The total number of polyps detected during colonoscopy for each participant within the 'symptomatic' participant population will be summed, and divided by the total number of colonoscopies in that participant population, to calculate MPP. MPP is usually expressed as a number to one decimal place., Whether or not at least one polyp is detected at colonoscopy will be determined for each participant. The number of colonoscopies where one or more polyps is detected will be divided by the total number of colonoscopies in that participant population to calculate PDR, which is normally expressed as a percentage., Whether or not at least one polyp is detected at colonoscopy will be determined for each participant within the 'screening' participant population. The number of colonoscopies where one or more polyps is identified will be divided by the total number of colonoscopies in that participant population to calculate PDR, which is normally expressed as a percentage., Whether or not at least one polyp is detected at colonoscopy will be determined for each participant within the 'symptomatic' participant population. The number of colonoscopies where one or more polyps is identified will be divided by the total number of colonoscopies in that participant population to calculate PDR, which is normally expressed as a percentage., The location, size, and morphology of the polyps identified (and histology if retrieved) in each study arm will be compared. This will also be analysed for both the screening and symptomatic participant populations in each study arm., The number of colonoscopies in each study arm in which one or more SSPs is identified, divided by the total number of colonoscopies in each arm. This will also be analysed for both the screening and symptomatic participant populations in each study arm., The number of CRCs detected in each study arm divided by the total number of colonoscopies in each arm. This will include polyps removed and later found to cancerous on histology and lesions felt to be cancerous at the time of colonoscopy. This will also be analysed for both the screening and symptomatic participant populations in each study arm., The number of AAs detected in each study arm divided by the total number of colonoscopies in each arm. This will also be analysed for both the screening and symptomatic participant populations in each study arm., Caecal intubation rate (the proportion of colonoscopies in which the colonoscope reaches the furthest extent of the colon) will be compared between the study arms to assess for non-inferiority, Insertion time to caecum (time taken to reach the furthest point of the large bowel) will be compared between the study arms to assess for non-inferiority, Total time required to perform the colonoscopy will be compared between the study arms to assess for non-inferiority, Total withdrawal time (time taken to remove the colonoscope from the furthest point of the colon) in the absence of any polyps will be compared between the study arms to assess for non-inferiority, Colonoscopist-assessed patient comfort scores will be compared between the study arms to assess for non-inferiority, Nurse-assessed patient comfort scores will be compared between the study arms to assess for non-inferiority, A validated Patient-Reported Experience Measure (Newcastle ENDOPREM) will be used to compare patient experience of colonoscopy between study arms, The EuroQoL EQ-5D-5L (validated quality of life questionnaire) will be used to compare patient-reported health-related quality of life, between study arms, The need for further colonoscopy for each participant is determined by the findings at the index colonoscopy, according to national guidelines on polyp surveillance. This may differ between study arms if more polyps are identified in one arm., Some colonoscopists partake in the national Bowel Cancer Screening Programme (BCSP) and some do not. MAP will be analysed by colonoscopist status within each study arm., Some colonoscopists partake in the national Bowel Cancer Screening Programme (BCSP) and some do not. ADR will be analysed by colonoscopist status within each study arm., MAP for the first 20 percent of participants will be compared to MAP for the last 20 percent of participants scoped by each participating colonoscopist, to assess for change over the course of the study., ADR for the first 20 percent of participants will be compared to ADR for the last 20 percent of participants scoped by each participating colonoscopist, to assess for change over the course of the study., MAP may vary from baseline, even in the control arm due to a contamination or learning effect; comparing baseline values to those during the study assesses for this effect., ADR may vary from baseline, even in the control arm due to a contamination or learning effect; comparing baseline values to those during the study assesses for this effect.",Interventional,,"Inclusion Criteria:

Able to give informed consent

Patients attending for colonoscopy

Through standard National Health Service (NHS) care (most commonly due to iron deficiency anaemia, altered bowel habit, weight loss, rectal bleeding, positive FIT (faecal immunohistochemical test) based on symptoms, those referred on basis of family history, abnormal cross- sectional imaging, polyp surveillance or post CRC surveillance)
Through Bowel Cancer Screening Programme (FIT positive, surveillance)
Colonoscopy to be performed by colonoscopist trained to perform GGC as part of the study

Exclusion Criteria:

Absolute contraindications to colonoscopy
Patients lacking capacity to give informed consent
Confirmed or expected pregnancy
Established or suspected large bowel obstruction or pseudo-obstruction
Known presence of colorectal cancer or polyposis syndromes
Known colonic strictures (meaning that the colonoscopy maybe incomplete)
Known active colitis (ulcerative colitis, Crohn's colitis, diverticulitis, infective colitis)
Inflammatory Bowel Disease (IBD) surveillance procedures
Patients who are on clopidogrel, warfarin, or other antiplatelet agents or anticoagulants who have not stopped this for the procedure (as polyps cannot be removed and thus histology cannot be confirmed)
Patients who are attending for a planned therapeutic procedure or assessment of a known lesion
Patients referred with polyps identified on Bowel Scope procedure","United Kingdom, United Kingdom, United Kingdom, United Kingdom, United Kingdom, United Kingdom, United Kingdom, United Kingdom, United Kingdom, United Kingdom",2021-01-26
NCT05766722,Cataract,Feasibility of an Artificial Intelligence Phone Call After Cataract Surgery,2023-12-01,DORA AI,Not Applicable,250,"Clinical safety will be assessed using the comparison between Dora's clinical decision and the OT team's clinical decision., System usability scale will be used to assess usability of the technology. The scores are 0-100, a score above a 68 would be considered above average and anything below 68 is below average, System usability scale will be used to assess appropriateness of the technology. The scores are 0-100, a score above a 68 would be considered above average and anything below 68 is below average, Cost effectiveness will be assessed by comparing the cost of the system to the clinic specific costs (resources used and potential staff-hours) and patient specific costs (travel and time needed to be taken off from work)",To determine what can be learnt to enhance AI technology in the field of ophthalmology especially when working with culturally diverse patients such as Punjabi and Chinese speaking patients by holding interviews from a randomly selected pool of applicants selected for an in-depth interview to better understand their experience with Dora such as challenges regarding communication and comprehension of the technology.,Interventional,,"Inclusion Criteria:

Patients who are undergoing uncomplicated cataract surgery at a high volume surgical centre.

Exclusion Criteria:

clinically significant complications during surgery that require more than the standard postop treatment or follow-up",,2023-03-13
NCT05792267,Pancreatic Disease,Clinical Research on a Novel Deep-learning Based System in Pancreatic Endoscopic Ultrasound Scanning,2024-01-31,artificial intelligence system,Not Applicable,200,"The number of correctly classified images divided by the total number of images., It was defined as the relative area of overlap between the predicted bounding box(A) and the ground-truth(B) bounding box., When the IoU was greater than the threshold, the prediction was true positive(TP); when the IoU was less than the threshold, the prediction was false positive(FP). When the model segmentation area was equal to 0, it was false negative(FN).Precision=TP/(TP+FP), Recall=TP/(TP+FN), Dice=2TP/(2TP+FP+FN)",This data is to evaluate the agreement between the model and the endoscopists.,Interventional,,"Inclusion Criteria:

1. Age ≥18 years old, <80 years old 2.Patients who need endoscopic ultrasonography of pancreas; 3. Agree to participate in this study and sign the informed consent form.

Exclusion Criteria:

Subjects who meet any of the following criteria cannot be selected for this trial:

First. The patient's physical condition does not meet the requirements of conventional endoscopic ultrasonography:

Poor physical condition, including hemoglobin ≤8.0g/dl, severe cardiopulmonary insufficiency, etc.
Anesthesia assessment failed
Pregnancy or breastfeeding
In the acute stage of chemical and corrosive injury, it is very easy to cause perforation
Recent acute coronary syndrome or clinically unstable ischemic heart attack
Heart disease patients with right-to-left shunt, patients with severe pulmonary hypertension (pulmonary artery pressure> 90mmHg),patients with uncontrolled systemic hypertension and patients with adult respiratory distress syndrome.

Second. Disagree to participate in this study.

Third. There are other problems that do not meet the requirements of this research or that affect the results of the research:

Pancreatic disease has undergone surgery or radiotherapy and chemotherapy beforehand;
Mental illness, drug addiction, inability to express themselves or other diseases that may affect follow-up.",China,2023-03-31
NCT06094270,Colonoscopy,Artificial-intelligence-based Reporting Technology for Endoscopy Monitoring and Imaging System,2024-03-31,EndoMind,Unaddressed,138,The error between gold standard withdrawal time and the withdrawal time estimated from the proposed AI system and the physician are compared for the same examination.,"A board of endoscopy experts receives the reports generated by the proposed system and evaluate the quality and satisfaction for the images included in the report. Evaluation will be performed on a Likert scale from 1 to 5., Interventions will be split into two categories, those containing at least one resection and those without any resections.The error between gold standard withdrawal time and the withdrawal time estimated from the proposed AI system and the physician are compared for each subgroups of examinations separately., Evaluation of the number of examinations where the withdrawal time could not be calculated and the causes.",Observational,,"Inclusion Criteria:

Adult patients (>18 years)
Scheduled for colonoscopy

Exclusion Criteria:

Patient / Examination level

Inflammatory Bowel Disease
Familial Polyposis Syndrome
Patient after radiation/resection of colonic parts

Data level

Endoscopic recordings started after beginning of withdrawal.
Examination recordings stopped before the end of the examination.
Examinations with corrupt video signal",Germany,2023-10-23
NCT05675540,"Wet Macular Degeneration, Diabetic Macular Edema, Retinal Vein Occlusion",Artificial Intelligence Diagnostic Aid,2024-03-30,Macusense Assessment Software,Unaddressed,422,The primary outcome measure is the percentage of agreement between the clinical decision of follow up interval and that made by Macusense at every treatment visit for each patient.,"Secondary outcome measure would include the change in central retinal thickness and macula volume as the anatomical measures and proportion of patients with loss of < 15 ETDRS letters, gain of >= 0 ETDRS letters and gain of >=15 ETDRS letters.",Observational,,"Inclusion Criteria:

Patients with a diagnosis of wet Age Related Macular Degeneration (wAMD), Diabetic Macular Oedema (DMO) and/or Retinal Vein Occlusion (RVO), who have already had a course of intravitreal treatment for at least one year.

Exclusion Criteria:

Patients with more than one ophthalmic pathology will be excluded
A patient will be excluded if, during the first year of treatment, they have needed cataract surgery or vitreoretinal surgery or have developed macular pathology other than wet AMD, DMO or RVO.
Patients included in other trials during the period the trial is running, will be excluded from eligibility.
Patients who do not wish to/are unable to consent will be excluded from the trial.
Patients aged 100 years and over",United Kingdom,2023-01-09
NCT05426135,"Artificial Intelligence, Deep Learning, Lung Cancer, Lung; Node, Stomach Cancer, Colon Cancer, Cancer Risk, Cancer Screening, Cancer, Treatment-Related",Artificial Intelligence System for Assessment of Tumor Risk and Diagnosis and Treatment,,,Unaddressed,3000,"The outcome of clinical diagnosis of patients with lung cancer/pulmonary nodular (Benign/Malignant nodule).

① Benign nodule

② Malignant neoplasm/nodule: squamous cell carcinoma, adenocarcinoma, small cell carcinoma, and large cell carcinoma., ① Benign

② Malignant, ① Benign

② Malignant, The treatment response of anti-cancer therapy at first evaluation in patients with lung/stomach/colorectal cancer follows The Response Evaluation Criteria In Solid Tumors (RECIST version 1.1) from the World Health Organization (WHO). The evaluation index is as follows.

CR (complete response): Disappearance of all target lesions and reduction in the short axis measurement of all pathologic lymph nodes to ≤10 mm.

PR (partial response): 30% decrease in the sum of the longest diameter of the target lesions compared with baseline.

PD (progressive disease):≥20% increase of at least 5 mm in the sum of the longest diameter of the target lesions compared with the smallest sum of the longest diameter recorded OR The appearance of new lesions, including those detected by FDG-PET (fludeoxyglucose positron emission tomography).

SD (stable disease): Neither PR nor PD.",,Observational,,"Inclusion Criteria:

Participants with the suspected of lung cancer/node, or stomach cancer/lesion, or colorectal cancer/leision
Participants that have signed informed consent.
Participants with detailed electronic medical records, image records, pathological records, multi-omics information, and other important clinical diagnostic information.
Healthy participants with no clinical diagnosis of lung cancer/node, or stomach cancer/lesion, or colorectal cancer/leision.

Exclusion Criteria:

Participants with primary clinical and pathological data missing.
Participants lost to follow-up.
Participants with too poor medical image quality to perform segment and mark ROI accurately",China,2022-06-21
NCT05870332,"Colonic Polyp, Colonic Adenoma, Colo-rectal Cancer",Nationwide Study of Artificial Intelligence in Adenoma Detection for Colonoscopy,2025-05-31,GI Genius (GIG),Unaddressed,4000,"The primary outcome measure will be adenoma detection rate. This will be studied across three phases: prior to use of CADe (baseline practice), while using CADe (study period) and finally after CADe (without the device in situ: ""washout"" phase).","Mean adenomas per colonoscopy (APC), Polyp size (mm) and location (in colonic segments), Total procedure (insertion+withdrawal) and withdrawal time",Observational,,"Inclusion Criteria:

Any patient aged 18-85 scheduled for colonoscopy by current NHSE / British Society of Gastroenterology criteria

Exclusion Criteria:

Colonoscopy being performed for polyp surveillance
Unable to provide informed, written consent",,2023-05-23
NCT05532774,Myopia,Efficacy and Safety of Defocusing Frame Glasses With Artificial Intelligence in Controlling Myopia Progression,2024-11-30,AI defocusing frame glasses,Not Applicable,138,Spherical equivalent as measured by cycloplegia autorefraction,,Interventional,,"Inclusion Criteria:

The cycloplegic refraction of two eyes is [-0.50D, -5.0D) the astigmatism is ≥ -1.50D; or the cycloplegic refraction of either eye is [-5.00, -10.00D), the astigmatism is ≥ -2.50D;
Willingness to wear only trial-provided defocusing frame glasses during the trial
Have normal thinking and language communication skills, and be able to actively cooperate with the treatment as required;
Written informed consent of guardian and child.

Exclusion Criteria:

Allergy or intolerance to cycloplegic drugs;
The anisometropia is greater than 1.50D;
Using atropine, rigid orthokeratology lenses, bifocal lenses or progressive lenses, red light, acupuncture, etc. for myopia treatment;
Strabismus/Amblyopia;
History of eye surgery (including strabismus correction);
Ocular or systemic diseases that may be related to the development of myopia or myopia: such as Marfan syndrome, neonatal retinopathy, diabetes, etc.;
Corneal, conjunctival or eyelid damage or other diseases (keratoconus, herpes simplex keratitis, etc.);
There are anatomical or skin factors that affect the wearing of spectacles;
Other circumstances that the investigator judges inappropriate to participate in the trial.",China,2022-09-08
NCT03969056,Hypertension,AI Activity Study in Patients With Elevated Blood Pressure,2022-06-30,"Artificial Intelligence (AI) Activity, 10,000 steps",Not Applicable,40,"measured by ActiGraph GT9X Link], measured by ActiGraph GT9X Link]","measured by SphigmoCor XCEL system, as measured in 24-hour urine samples, using weight and height to calculate",Interventional,,"Inclusion Criteria:

age ≥18 years
systolic blood pressure between 130 mmHg to 180 mmHg or/and diastolic blood *pressure between 80 to 100 mmHg in a research office
speaking and reading English
being physically inactive at work or during leisure time and willing to be physically active
having an iPhone 8 or newer or an Android Lollipop or newer

Exclusion Criteria:

self-reported diagnosis of coronary heart disease, medical condition or other physical problem necessitating special attention in an exercise program (e.g., cancer, eating disorder, uncontrolled diabetes)
current participation in a lifestyle modification program or research study
self-report of being currently pregnant.",United States,2019-05-31
NCT05068778,Periodontal Diseases,Development of an AI App to Improve Compliance in Periodontal Maintenance Patients,2023-06-01,Artificial Intelligence Application,Unaddressed,50,Digital hygiene app will provide messages to subjects via their smartphone regarding their their lst maintenance appointment and throughout the study.,"the increase the compliance score ant 3 and 6 months after subject begins use of the AI app, number of subjects with a lesser degree of recession from baseline to end of study due to increased subject compliance, number of subjects with a lesser probing depth from baseline to end of study due to increased subject compliance, number of subjects with improved clinical attachment level due to increased subject compliance, number of subjects with a reduction in gingival inflammation due to increased subject compliance, number of subjects showing a decreased degree of tooth mobility due to increased subject compliance",Observational,,"Inclusion Criteria:

Subjects 18 to 75-yrs of age
Subjects with diagnosis and treatment of Generalized and/or Localized Periodontitis Stages I, II, or III; grades A-C and or Peri-implantitis (Generalized Mild, Moderate, or Advanced Chronic Periodontitis) who are following a periodontal maintenance interval of every three months.
Subjects are able to provide self-care (oral hygiene) without disabilities requiring assistance with daily oral hygiene measures.
Subjects will have read, understood and signed an institutional review board (IRB) approved Informed Consent Form (ICF).
Subjects must be able and willing to follow study procedures and instructions.

Exclusion Criteria:

Subjects who do not own or are incapable of interacting with a smart phone or device
Subjects who are incapable of operating an application on a smart phone or device
Subjects who are not compliant with periodontal maintenance / recall intervals (Based on Wilson's classification as any lack of compliance with their recommended maintenance interval- therefore exclude subjects who demonstrate erratic compliance or noncompliance)18
Subjects who require active periodontal therapy during the study
Subjects who are on immunosuppressive medications, chemotherapy, or radiation therapy which would adversely affect their periodontal stability.
Subjects participating in other clinical studies involving therapeutic intervention (either medical or dental).

Subjects, who in the opinion of the investigator, for any reason other than those listed above, will not be able to complete the study per protocol.

-

Exclusion Criteria:

-","United States, United States",2021-10-06
